<?xml version="1.0" encoding="utf-8" standalone="no"?>
<competitie xmlns:xsi="http://www.w3.org/2001/XMLSchema-instance" xsi:noNamespaceSchemaLocation="language.xsd">
    <entry name="titleJFrameDesktopMain">Kohtopa Desktop Application</entry>
    <entry name="errWriteLangFile">failed to write language file</entry>
    <entry name="errLookAndFeelNotFound">Failed to locate look and feel nimbus\\nYou need version 1.6_18 of jre for smooth look and feel</entry>
    <entry name="errWriteLangFileTitle">language fail</entry>
    <entry name="titleCalendar">Calendar</entry>
    <entry name="errLookAndFeelNotFoundTitle">Look and Feel not found</entry>
    <entry name="titleAddRemove">Add / Remove</entry>
</competitie>